{
  "schema_version": "1.0.0",
  "adjudication_submission_id": "adjudication-submission-example-v1",
  "case_id": "example-case",
  "cohort_id": "example-en-cmt-cohort",
  "cohort_version": "1.0.0",
  "source_language": "en",
  "task_layer": "cmt",
  "queue_snapshot": {
    "queue_version": "1.0.0",
    "queue_schema_version": "1.0.0",
    "queue_source": "quality/human-reliability/comparisons/example-en-cmt-cohort-1.0.0/adjudication-queue.json",
    "queue_sha256": "sha256:0000000000000000000000000000000000000000000000000000000000000000",
    "queue_generator_script": "scripts/human_reliability/generate_adjudication_queue.py",
    "queue_generator_version": "1.0.0",
    "queue_generator_script_hash": "sha256:0000000000000000000000000000000000000000000000000000000000000000",
    "queue_code_revision": "replace-with-queue-code-revision",
    "frozen_at": "2026-06-22T12:00:00Z"
  },
  "adjudicator": {
    "adjudicator_id": "adjudicator-example-001",
    "role": "authorized_human_adjudicator",
    "authorization_id": "authorization-example-001",
    "independence_attested": true,
    "primary_coder_for_cohort": false,
    "sole_adjudicator": true,
    "source_language_qualified": true,
    "conflict_status": "none_declared",
    "conflict_details": null
  },
  "submitted_at": "2026-06-22T13:00:00Z",
  "decisions": [
    {
      "adjudication_id": "adjudication-example-001",
      "queue_id": "human-queue-0000000000000000",
      "disagreement_id": "human-disagreement-0000000000000000",
      "item_id": "example-item-001",
      "reference_id": "example-reference-001",
      "unit_id": null,
      "field": "cmt.target_domain",
      "status": "unresolved",
      "selected_basis": "no_resolution",
      "adjudicated_value": null,
      "rationale": "Replace with the adjudicator's bounded rationale.",
      "evidence_consulted": [
        {
          "evidence_id": "queue-context-example-001",
          "evidence_type": "queue_source_text",
          "source": "adjudication-queue.json#human-queue-0000000000000000",
          "sha256": null,
          "note": "Replace with the evidence actually consulted."
        }
      ],
      "confidence": null,
      "codebook_need": {
        "status": "unresolved",
        "affected_sections": ["cmt.target_domain"],
        "rationale": "Determine whether the field guidance distinguishes the rival readings.",
        "recoding_required": false
      },
      "correction_candidate": {
        "status": "deferred",
        "candidate_id": null,
        "target": null,
        "rationale": "No correction can be proposed until the adjudication is resolved.",
        "promotion_status": "pending_separate_authorization",
        "promotion_id": null,
        "direct_write_permitted": false
      },
      "affected_claims": [],
      "affected_claim_dimensions": ["metaphor-mapping"],
      "follow_up": {
        "required": true,
        "actions": ["Consult additional source-language semantic evidence."],
        "owner_role": "adjudication_coordinator",
        "due_at": null
      },
      "decided_at": "2026-06-22T13:00:00Z"
    }
  ]
}
